### ISSUE TITLE
Question for PODM do not find second PSME server and PSME compute simulator

### ISSUE THREAD

**Issue by housemic** [intel/intelRSD#50]
Dear intel -
the question is related to -
run PSME server and compute simulator and PODM but not found compute assets #38

I successfully startup a PODM (OS: ubuntu16.04,  IP: 192.168.1.135, hostname : podm1)
and first PSME server and PSME compute simulator  (OS: ubuntu16.04,  IP: 192.168.1.105, hostname : psme1),
first PSME server built LUI (Linux Utility Image - bzimage) and copyed to PODM,

in PODM -  https://localhost:8443/redfish/v1/Systems
found first PSME compute asset ( 1 host),
in PODM -  https://localhost:8443/redfish/v1/Systems/1-s-10
I can see the first PSME compute asset,

but second PSME server do not build LUI (Linux Utility Image - bzimage),
but when I startup second PSME server and PSME compute simulator  (OS: ubuntu16.04,  IP: 192.168.1.87, hostname : psme2),
in PODM -  https://localhost:8443/redfish/v1/Systems
only found first PSME compute asset (1 host),
PODM do not find second PSME compute asset.

my Questions are -
Q1. Does second PSME server need to build again LUI ?

Q2. if second PSME server build a new LUI, file name is bzimage, Does it need to rename to another file name ?

Q3. if second PSME LUI (bzimage) will copy to PODM - /opt/pod-manager/wildfly/discovery/bzimage, the first PSME's LUI file will be overwrite, Is it a problem ? 

thank you
House

**Comment by tbykowsk** [comment]
The Linux Utility Image (LUI) runs on all Intel RSD reference platforms. There is no need to prepare multiple bzImages - one bzImage should handle all platforms within one PODM. You may only need to adjust the image to your hardware.
The LUI is used for the Deep Discovery feature as I pointed out in your another issue. It is not supposed to be run on a drawer where a PSME Compute Agent is, but on sleds within the drawer. After PODM had discovered basic information about a sled from the PSME Compute Agent, then it can start the LUI on the sled (as a temporary OS) to gather more data. This feature will not work, if a PSME Compute Simulator Agent is running on a drawer.

You have written, that PODM does not detect your system on _"psme2"_ host. Have you added it to `/tmp/services.list`? Does it change, when you disable _"psme1"_ host?

**Comment by housemic** [comment]
Dear tbykowsk ,
PODM can find PSME compute asset after I add additional setting in : /tmp/services.list
https://<PSME_IP>:8443/redfish/v1 psme

thank you
House

**Comment by housemic** [comment]
Dear tbykowsk ,
Question 4 - In my environment that I only run PSME server and PSME Compute Agent Simulator , 
This feature (deep discovery ) and LUI (bzimage) do not work on PODM,   Is it right ?
thanks
House

**Comment by tbykowsk** [comment]
PSME Compute Agent reads information about a sled (computer system) using IPMI. PODM treats this data as "Basic" information about the sled, and can trigger "Deep Discovery" on the sled to gather more data. A simplified flow of this feature is as follows:
1. PODM gathers "Basic" data about the sled from PSME Compute Agent
2. PODM triggers "Deep Discovery" on the sled
3. PODM orders PSME Compute Agent to power on the sled and to boot it from PXE
4. The sled downloads LUI (bzImage) from PODM and boots it
5. PODM gathers "Deep" data about the sled from booted LUI
6. PODM orders PSME Compute Agent to power off the sled

Since the v2.1.3 release the "Deep Discovery" feature is becoming less important, because now more data about computer systems can be read via IPMI from SMBIOS (details in [Section 3](https://www.intel.com/content/www/us/en/architecture-and-technology/rack-scale-design/firmware-extension-spec-v2-2.html)).

**Comment by housemic** [comment]
Dear tbykowsk ,
Question 5 -
In my environment that I only run PSME server and PSME Compute Agent Simulator ,
If I do not add PSME IP address in : /tmp/services.list
https://<PSME_IP>:8443/redfish/v1 psme

in my test, 
in PODM, use web browser to -  https://localhost:8443/redfish/v1/Systems
can not find compute assets (hardware information) about the PSME and its Compute Agent Simulator, member count is 0 (Zero),

Does PODM always need the settings -  /tmp/services.list  ?
thank you
House

**Comment by RobertCMa** [comment]
Hi @housemic,

It can refer to the PODM user guide chapter 3 for more ideas about the PODM discovery, which is same as the one discussed in issue#38

Editing the file of services.list is a static method to locate the other service or resource.

**Comment by fberndl** [comment]
Hi @housemic ,
If the PODM acts as DHCP server for the compute PSME's he searches for it in his dhcp leases.. Another way is to use SSDP. But you should probably read trough the documentation to understand this .

**Comment by RobertCMa** [comment]
Hi @housemic ,
I'm closing this issue due to inactivity. Feel free to open a new one if needed.

**Comment by housemic** [comment]
Dear RobertCMa, fberndl, tbykowsk,
currently my PODM is not DHCP server, 
PSME IP was assigned IP address by HUB hardware that has DHCP function,

but I check PODM and PSME log that they have SSDP started messages ,

PODM  log -
2018-01-11 22:43:41,707 [ServerService Thread Pool -- 58] INFO  c.i.p.s.d.ssdp.SsdpServiceDetector - Initializing SSDP based service detector...

PSME log -
2017-12-22 00:41:59.588003293 - INFO  - rest - REST server started.
2017-12-22 00:41:59.588310031 - INFO  - rest - Initially invalidated 0 persistence entries
2017-12-22 00:41:59.588327007 - INFO  - rest - RetentionPolicy started run #1
2017-12-22 00:41:59.589438404 - INFO  - ssdp - 
SSDP active on interfaces:
     open notification sockets:
2017-12-22 00:41:59.589476236 - INFO  - ssdp - SSDP service started.


I think that I have problem is -
when I startup PODM, PSME REST server, and PSME compute agent simulator,
I do not add PSME services - https://<PSME_IP>:8443/redfish/v1 psme
into the file - /tmp/services.list
the PODM do not find PSME's compute asset,
Does SSDP of PODM and PSME fail ? thank you.
House

**Comment by tbykowsk** [comment]
Hi @housemic,

If you have a custom network setup, then you may need to change the default SSDP configuration for PSME Rest Server. Try to increase [TTL](https://github.com/intel/intelRSD/blob/master/PSME/application/configuration.json#L28) and set [announce interval](https://github.com/intel/intelRSD/blob/master/PSME/application/configuration.json#L27) to non-zero. Also make sure that SSDP frames are not blocked in your network.

**Comment by fberndl** [comment]
Hi @housemic,
I would recommend to check the connections first:

1. Connect to your pod manager and try the following command "curl -u 'user:password' -vX GET --header 'Content-Type: application/json" -s --insecure | python -m json.tool'"

**Comment by housemic** [comment]
Dear tbykowsk,
I  increase TTL to 9 and set announce interval to 60,
PODM still not find PSME REST server,
if PODM find it, 
the PODM log - /var/log/pod-manager/pod-manager/pod-manager-services-detection 
will have a new PSME service record like this -
Service {URI=https://192.168.1.135:8443/redfish/v1/, type=PSME, UUID=3ddcdcb8-fb16-11e7-8a1f-774dbb7e1223} detected

House

**Comment by tbykowsk** [comment]
PODM should log service detection in `/var/log/pod-manager/pod-manager-services-detection.log` as you stated.
Can you connect to PSME Server REST API from PODM?
Could you confirm that SSDP packets are being received on PODM/PSME side (e.g. using tcpdump or Wireshark)?

**Comment by housemic** [comment]
Dear tbykowsk,
I use tcpdump to display network packets,
found that
PODM send M-SEARCH,
but PSME do not response.

the following action are my steps -


I installed 2 PODM and 1 PSME (running PSME REST Server and PSME compute agent simulator),

PODM No.1 IP Address - 192.168.1.87

PODM No.2 IP Address - 192.168.1.105

PSME Server No.1 IP Address - 192.168.1.135


-------------------------------------------------------------------------------------


user@psme1:~$ sudo tcpdump -ni any host 192.168.1.87 -ttttt
[sudo] password for user: 
tcpdump: verbose output suppressed, use -v or -vv for full protocol decode
listening on any, link-type LINUX_SLL (Linux cooked), capture size 262144 bytes
 00:00:00.000000 ARP, Request who-has 192.168.1.136 tell 192.168.1.87, length 46
 00:00:01.025627 ARP, Request who-has 192.168.1.136 tell 192.168.1.87, length 46
 00:00:02.049630 ARP, Request who-has 192.168.1.136 tell 192.168.1.87, length 46
 00:01:05.999759 ARP, Request who-has 192.168.1.136 tell 192.168.1.87, length 46
 00:01:07.009332 ARP, Request who-has 192.168.1.136 tell 192.168.1.87, length 46
 00:01:08.033352 ARP, Request who-has 192.168.1.136 tell 192.168.1.87, length 46
 00:02:12.999427 ARP, Request who-has 192.168.1.136 tell 192.168.1.87, length 46
 00:02:14.017123 ARP, Request who-has 192.168.1.136 tell 192.168.1.87, length 46
 00:02:15.041051 ARP, Request who-has 192.168.1.136 tell 192.168.1.87, length 46
 00:02:39.147555 IP 192.168.1.87.46431 > 239.255.255.250.1900: UDP, length 121
 00:02:39.647745 IP 192.168.1.87.46431 > 239.255.255.250.1900: UDP, length 121
 00:02:40.147883 IP 192.168.1.87.46431 > 239.255.255.250.1900: UDP, length 121
 00:03:19.999071 ARP, Request who-has 192.168.1.136 tell 192.168.1.87, length 46
 00:03:21.024762 ARP, Request who-has 192.168.1.136 tell 192.168.1.87, length 46
 00:03:22.048746 ARP, Request who-has 192.168.1.136 tell 192.168.1.87, length 46
 00:04:26.998864 ARP, Request who-has 192.168.1.136 tell 192.168.1.87, length 46
 00:04:28.000512 ARP, Request who-has 192.168.1.136 tell 192.168.1.87, length 46
 00:04:29.024453 ARP, Request who-has 192.168.1.136 tell 192.168.1.87, length 46
 00:05:33.998520 ARP, Request who-has 192.168.1.136 tell 192.168.1.87, length 46
 00:05:35.008150 ARP, Request who-has 192.168.1.136 tell 192.168.1.87, length 46
 00:05:36.032174 ARP, Request who-has 192.168.1.136 tell 192.168.1.87, length 46
 00:06:37.998240 ARP, Request who-has 192.168.1.136 tell 192.168.1.87, length 46
 00:06:39.007856 ARP, Request who-has 192.168.1.136 tell 192.168.1.87, length 46
 00:06:40.031891 ARP, Request who-has 192.168.1.136 tell 192.168.1.87, length 46
 00:07:41.997968 ARP, Request who-has 192.168.1.136 tell 192.168.1.87, length 46
 00:07:43.007568 ARP, Request who-has 192.168.1.136 tell 192.168.1.87, length 46
 00:07:44.031569 ARP, Request who-has 192.168.1.136 tell 192.168.1.87, length 46
 00:08:48.997639 ARP, Request who-has 192.168.1.136 tell 192.168.1.87, length 46
 00:08:50.015294 ARP, Request who-has 192.168.1.136 tell 192.168.1.87, length 46
 00:08:51.039247 ARP, Request who-has 192.168.1.136 tell 192.168.1.87, length 46
 00:09:53.997388 ARP, Request who-has 192.168.1.136 tell 192.168.1.87, length 46
 00:09:55.007053 ARP, Request who-has 192.168.1.136 tell 192.168.1.87, length 46
 00:09:56.030988 ARP, Request who-has 192.168.1.136 tell 192.168.1.87, length 46
 00:11:00.997040 ARP, Request who-has 192.168.1.136 tell 192.168.1.87, length 46
 00:11:02.014709 ARP, Request who-has 192.168.1.136 tell 192.168.1.87, length 46
 00:11:03.038716 ARP, Request who-has 192.168.1.136 tell 192.168.1.87, length 46
 00:12:04.996720 ARP, Request who-has 192.168.1.136 tell 192.168.1.87, length 46
 00:12:06.014396 ARP, Request who-has 192.168.1.136 tell 192.168.1.87, length 46
 00:12:07.038385 ARP, Request who-has 192.168.1.136 tell 192.168.1.87, length 46
 00:12:39.144951 IP 192.168.1.87.46431 > 239.255.255.250.1900: UDP, length 121
 00:12:39.645283 IP 192.168.1.87.46431 > 239.255.255.250.1900: UDP, length 121
 00:12:40.145431 IP 192.168.1.87.46431 > 239.255.255.250.1900: UDP, length 121
 00:13:09.996464 ARP, Request who-has 192.168.1.136 tell 192.168.1.87, length 46
 00:13:11.006108 ARP, Request who-has 192.168.1.136 tell 192.168.1.87, length 46
 00:13:12.030094 ARP, Request who-has 192.168.1.136 tell 192.168.1.87, length 46
 00:14:16.996100 ARP, Request who-has 192.168.1.136 tell 192.168.1.87, length 46




-------------------------------------------------------------------------------------



user@psme1:~$ sudo tcpdump -ni any host 192.168.1.105 -ttttt
[sudo] password for user: 
tcpdump: verbose output suppressed, use -v or -vv for full protocol decode
listening on any, link-type LINUX_SLL (Linux cooked), capture size 262144 bytes
 00:00:00.000000 IP 192.168.1.105.41150 > 239.255.255.250.1900: UDP, length 121
 00:00:00.500205 IP 192.168.1.105.41150 > 239.255.255.250.1900: UDP, length 121
 00:00:01.000491 IP 192.168.1.105.41150 > 239.255.255.250.1900: UDP, length 121
 00:00:43.436017 ARP, Request who-has 192.168.1.1 tell 192.168.1.105, length 46
 00:00:44.466813 ARP, Request who-has 192.168.1.1 tell 192.168.1.105, length 46
 00:00:45.486806 ARP, Request who-has 192.168.1.1 tell 192.168.1.105, length 46
 00:00:48.441023 ARP, Request who-has 192.168.1.1 tell 192.168.1.105, length 46
 00:00:49.458828 ARP, Request who-has 192.168.1.1 tell 192.168.1.105, length 46
 00:00:50.478782 ARP, Request who-has 192.168.1.1 tell 192.168.1.105, length 46
 00:00:53.446076 ARP, Request who-has 192.168.1.1 tell 192.168.1.105, length 46
 00:00:54.446770 ARP, Request who-has 192.168.1.1 tell 192.168.1.105, length 46
 00:00:55.470746 ARP, Request who-has 192.168.1.1 tell 192.168.1.105, length 46
 00:00:58.451153 ARP, Request who-has 192.168.1.1 tell 192.168.1.105, length 46
 00:00:59.470723 ARP, Request who-has 192.168.1.1 tell 192.168.1.105, length 46
 00:01:00.494730 ARP, Request who-has 192.168.1.1 tell 192.168.1.105, length 46
 00:01:03.456318 ARP, Request who-has 192.168.1.1 tell 192.168.1.105, length 46
 00:01:04.462745 ARP, Request who-has 192.168.1.1 tell 192.168.1.105, length 46
 00:01:05.486705 ARP, Request who-has 192.168.1.1 tell 192.168.1.105, length 46
 00:01:08.461332 ARP, Request who-has 192.168.1.1 tell 192.168.1.105, length 46
 00:01:09.486738 ARP, Request who-has 192.168.1.1 tell 192.168.1.105, length 46
 00:01:10.510737 ARP, Request who-has 192.168.1.1 tell 192.168.1.105, length 46
 00:01:13.466443 ARP, Request who-has 192.168.1.1 tell 192.168.1.105, length 46
 00:01:14.478644 ARP, Request who-has 192.168.1.1 tell 192.168.1.105, length 46
 00:01:15.502694 ARP, Request who-has 192.168.1.1 tell 192.168.1.105, length 46
 00:01:18.471507 ARP, Request who-has 192.168.1.1 tell 192.168.1.105, length 46
 00:01:19.502569 ARP, Request who-has 192.168.1.1 tell 192.168.1.105, length 46
 00:01:20.526610 ARP, Request who-has 192.168.1.1 tell 192.168.1.105, length 46
 00:05:43.434981 ARP, Request who-has 192.168.1.1 tell 192.168.1.105, length 46
 00:05:44.460837 ARP, Request who-has 192.168.1.1 tell 192.168.1.105, length 46
 00:05:45.484896 ARP, Request who-has 192.168.1.1 tell 192.168.1.105, length 46
 00:05:48.439991 ARP, Request who-has 192.168.1.1 tell 192.168.1.105, length 46
 00:05:49.452846 ARP, Request who-has 192.168.1.1 tell 192.168.1.105, length 46
 00:05:50.476853 ARP, Request who-has 192.168.1.1 tell 192.168.1.105, length 46
 00:05:53.445041 ARP, Request who-has 192.168.1.1 tell 192.168.1.105, length 46
 00:05:54.476758 ARP, Request who-has 192.168.1.1 tell 192.168.1.105, length 46
 00:05:55.500755 ARP, Request who-has 192.168.1.1 tell 192.168.1.105, length 46
 00:05:58.450024 ARP, Request who-has 192.168.1.1 tell 192.168.1.105, length 46
 00:05:59.468732 ARP, Request who-has 192.168.1.1 tell 192.168.1.105, length 46
 00:06:00.492752 ARP, Request who-has 192.168.1.1 tell 192.168.1.105, length 46
 00:06:03.455289 ARP, Request who-has 192.168.1.1 tell 192.168.1.105, length 46
 00:06:04.460699 ARP, Request who-has 192.168.1.1 tell 192.168.1.105, length 46
 00:06:05.484694 ARP, Request who-has 192.168.1.1 tell 192.168.1.105, length 46
 00:06:08.460293 ARP, Request who-has 192.168.1.1 tell 192.168.1.105, length 46
 00:06:09.484696 ARP, Request who-has 192.168.1.1 tell 192.168.1.105, length 46
 00:06:10.508707 ARP, Request who-has 192.168.1.1 tell 192.168.1.105, length 46
 00:06:13.465402 ARP, Request who-has 192.168.1.1 tell 192.168.1.105, length 46
 00:06:14.476740 ARP, Request who-has 192.168.1.1 tell 192.168.1.105, length 46
 00:06:15.500626 ARP, Request who-has 192.168.1.1 tell 192.168.1.105, length 46
 00:06:18.470366 ARP, Request who-has 192.168.1.1 tell 192.168.1.105, length 46
 00:06:19.500600 ARP, Request who-has 192.168.1.1 tell 192.168.1.105, length 46
 00:06:20.524617 ARP, Request who-has 192.168.1.1 tell 192.168.1.105, length 46
 00:09:59.996318 IP 192.168.1.105.41150 > 239.255.255.250.1900: UDP, length 121
 00:10:00.496526 IP 192.168.1.105.41150 > 239.255.255.250.1900: UDP, length 121
 00:10:00.996751 IP 192.168.1.105.41150 > 239.255.255.250.1900: UDP, length 121



-------------------------------------------------------------------------------------


user@psme1:~$ sudo tcpdump -ni any host 192.168.1.135 -ttttt
[sudo] password for user: 
tcpdump: verbose output suppressed, use -v or -vv for full protocol decode
listening on any, link-type LINUX_SLL (Linux cooked), capture size 262144 bytes
 00:00:00.000000 ARP, Request who-has 192.168.1.1 tell 192.168.1.135, length 28
 00:00:00.999996 ARP, Request who-has 192.168.1.1 tell 192.168.1.135, length 28
 00:00:02.000064 IP 192.168.1.135 > 192.168.1.135: ICMP host 192.168.1.1 unreachable, length 84
 00:00:02.000071 IP 192.168.1.135 > 192.168.1.135: ICMP host 192.168.1.1 unreachable, length 84
 00:00:02.000072 IP 192.168.1.135 > 192.168.1.135: ICMP host 192.168.1.1 unreachable, length 68
 00:00:04.007690 ARP, Request who-has 192.168.1.1 tell 192.168.1.135, length 28
 00:00:05.003991 ARP, Request who-has 192.168.1.1 tell 192.168.1.135, length 28
 00:00:06.003996 ARP, Request who-has 192.168.1.1 tell 192.168.1.135, length 28
 00:00:07.004058 IP 192.168.1.135 > 192.168.1.135: ICMP host 192.168.1.1 unreachable, length 84
 00:00:07.004063 IP 192.168.1.135 > 192.168.1.135: ICMP host 192.168.1.1 unreachable, length 84
 00:00:07.004065 IP 192.168.1.135 > 192.168.1.135: ICMP host 192.168.1.1 unreachable, length 68
 00:00:09.012826 ARP, Request who-has 192.168.1.1 tell 192.168.1.135, length 28
 00:00:10.012029 ARP, Request who-has 192.168.1.1 tell 192.168.1.135, length 28
 00:00:11.011970 ARP, Request who-has 192.168.1.1 tell 192.168.1.135, length 28
 00:00:12.012055 IP 192.168.1.135 > 192.168.1.135: ICMP host 192.168.1.1 unreachable, length 84
 00:00:12.012061 IP 192.168.1.135 > 192.168.1.135: ICMP host 192.168.1.1 unreachable, length 84
 00:00:12.012062 IP 192.168.1.135 > 192.168.1.135: ICMP host 192.168.1.1 unreachable, length 68
 00:00:14.018037 ARP, Request who-has 192.168.1.1 tell 192.168.1.135, length 28
 00:00:15.015989 ARP, Request who-has 192.168.1.1 tell 192.168.1.135, length 28
 00:00:16.016003 ARP, Request who-has 192.168.1.1 tell 192.168.1.135, length 28
 00:00:17.016077 IP 192.168.1.135 > 192.168.1.135: ICMP host 192.168.1.1 unreachable, length 84
 00:00:19.023599 ARP, Request who-has 192.168.1.1 tell 192.168.1.135, length 28
 00:00:20.020060 ARP, Request who-has 192.168.1.1 tell 192.168.1.135, length 28
 00:00:21.019993 ARP, Request who-has 192.168.1.1 tell 192.168.1.135, length 28
 00:00:22.020013 IP 192.168.1.135 > 192.168.1.135: ICMP host 192.168.1.1 unreachable, length 84
 00:00:24.779228 ARP, Request who-has 192.168.1.1 tell 192.168.1.135, length 28
 00:00:25.776005 ARP, Request who-has 192.168.1.1 tell 192.168.1.135, length 28
 00:00:26.775983 ARP, Request who-has 192.168.1.1 tell 192.168.1.135, length 28
 00:00:27.776033 IP 192.168.1.135 > 192.168.1.135: ICMP host 192.168.1.1 unreachable, length 68
 00:00:27.776037 IP 192.168.1.135 > 192.168.1.135: ICMP host 192.168.1.1 unreachable, length 68
 00:00:27.776038 IP 192.168.1.135 > 192.168.1.135: ICMP host 192.168.1.1 unreachable, length 78
 00:00:29.784949 ARP, Request who-has 192.168.1.1 tell 192.168.1.135, length 28
 00:00:30.783951 ARP, Request who-has 192.168.1.1 tell 192.168.1.135, length 28
 00:00:31.784010 ARP, Request who-has 192.168.1.1 tell 192.168.1.135, length 28
 00:00:32.784289 IP 192.168.1.135 > 192.168.1.135: ICMP host 192.168.1.1 unreachable, length 68
 00:00:32.784303 IP 192.168.1.135 > 192.168.1.135: ICMP host 192.168.1.1 unreachable, length 68
 00:00:32.784304 IP 192.168.1.135 > 192.168.1.135: ICMP host 192.168.1.1 unreachable, length 78
 00:00:34.789826 ARP, Request who-has 192.168.1.1 tell 192.168.1.135, length 28
 00:00:35.787952 ARP, Request who-has 192.168.1.1 tell 192.168.1.135, length 28
 00:00:36.787995 ARP, Request who-has 192.168.1.1 tell 192.168.1.135, length 28
 00:00:37.788033 IP 192.168.1.135 > 192.168.1.135: ICMP host 192.168.1.1 unreachable, length 68
 00:00:37.788040 IP 192.168.1.135 > 192.168.1.135: ICMP host 192.168.1.1 unreachable, length 68
 00:00:37.788041 IP 192.168.1.135 > 192.168.1.135: ICMP host 192.168.1.1 unreachable, length 78
 00:00:39.794897 ARP, Request who-has 192.168.1.1 tell 192.168.1.135, length 28
 00:00:40.792043 ARP, Request who-has 192.168.1.1 tell 192.168.1.135, length 28
 00:00:41.792004 ARP, Request who-has 192.168.1.1 tell 192.168.1.135, length 28
 00:00:42.792028 IP 192.168.1.135 > 192.168.1.135: ICMP host 192.168.1.1 unreachable, length 68
 00:00:42.792035 IP 192.168.1.135 > 192.168.1.135: ICMP host 192.168.1.1 unreachable, length 68
 00:00:42.792036 IP 192.168.1.135 > 192.168.1.135: ICMP host 192.168.1.1 unreachable, length 78
 00:00:44.800252 ARP, Request who-has 192.168.1.1 tell 192.168.1.135, length 28
 00:00:45.799967 ARP, Request who-has 192.168.1.1 tell 192.168.1.135, length 28
 00:00:46.799963 ARP, Request who-has 192.168.1.1 tell 192.168.1.135, length 28
 00:00:47.800053 IP 192.168.1.135 > 192.168.1.135: ICMP host 192.168.1.1 unreachable, length 68
 00:00:47.800058 IP 192.168.1.135 > 192.168.1.135: ICMP host 192.168.1.1 unreachable, length 68
 00:00:47.800059 IP 192.168.1.135 > 192.168.1.135: ICMP host 192.168.1.1 unreachable, length 78
 00:00:49.806090 ARP, Request who-has 192.168.1.1 tell 192.168.1.135, length 28
 00:00:50.804035 ARP, Request who-has 192.168.1.1 tell 192.168.1.135, length 28
 00:00:51.803980 ARP, Request who-has 192.168.1.1 tell 192.168.1.135, length 28
 00:00:52.804077 IP 192.168.1.135 > 192.168.1.135: ICMP host 192.168.1.1 unreachable, length 68
 00:00:52.804085 IP 192.168.1.135 > 192.168.1.135: ICMP host 192.168.1.1 unreachable, length 68
 00:00:52.804086 IP 192.168.1.135 > 192.168.1.135: ICMP host 192.168.1.1 unreachable, length 78
 00:00:54.811210 ARP, Request who-has 192.168.1.1 tell 192.168.1.135, length 28
 00:00:55.807974 ARP, Request who-has 192.168.1.1 tell 192.168.1.135, length 28
 00:00:56.808061 ARP, Request who-has 192.168.1.1 tell 192.168.1.135, length 28
 00:00:57.808236 IP 192.168.1.135 > 192.168.1.135: ICMP host 192.168.1.1 unreachable, length 68
 00:00:57.808271 IP 192.168.1.135 > 192.168.1.135: ICMP host 192.168.1.1 unreachable, length 68
 00:00:59.816332 ARP, Request who-has 192.168.1.1 tell 192.168.1.135, length 28
 00:01:00.815995 ARP, Request who-has 192.168.1.1 tell 192.168.1.135, length 28
 00:01:01.816001 ARP, Request who-has 192.168.1.1 tell 192.168.1.135, length 28
 00:01:02.816045 IP 192.168.1.135 > 192.168.1.135: ICMP host 192.168.1.1 unreachable, length 68
 00:01:02.816053 IP 192.168.1.135 > 192.168.1.135: ICMP host 192.168.1.1 unreachable, length 68
 00:01:04.821360 ARP, Request who-has 192.168.1.1 tell 192.168.1.135, length 28
 00:01:05.819949 ARP, Request who-has 192.168.1.1 tell 192.168.1.135, length 28
 00:01:06.819971 ARP, Request who-has 192.168.1.1 tell 192.168.1.135, length 28
 00:01:07.820289 IP 192.168.1.135 > 192.168.1.135: ICMP host 192.168.1.1 unreachable, length 68
 00:01:07.820365 IP 192.168.1.135 > 192.168.1.135: ICMP host 192.168.1.1 unreachable, length 68
 00:01:09.826728 ARP, Request who-has 192.168.1.1 tell 192.168.1.135, length 28
 00:01:10.823991 ARP, Request who-has 192.168.1.1 tell 192.168.1.135, length 28
 00:01:11.823984 ARP, Request who-has 192.168.1.1 tell 192.168.1.135, length 28
 00:01:12.824041 IP 192.168.1.135 > 192.168.1.135: ICMP host 192.168.1.1 unreachable, length 68
 00:01:12.824047 IP 192.168.1.135 > 192.168.1.135: ICMP host 192.168.1.1 unreachable, length 68
 00:01:14.831730 ARP, Request who-has 192.168.1.1 tell 192.168.1.135, length 28
 00:01:15.827989 ARP, Request who-has 192.168.1.1 tell 192.168.1.135, length 28
 00:01:16.827964 ARP, Request who-has 192.168.1.1 tell 192.168.1.135, length 28
 00:01:17.828245 IP 192.168.1.135 > 192.168.1.135: ICMP host 192.168.1.1 unreachable, length 68
 00:01:17.828268 IP 192.168.1.135 > 192.168.1.135: ICMP host 192.168.1.1 unreachable, length 68
 00:01:17.828272 IP 192.168.1.135 > 192.168.1.135: ICMP host 192.168.1.1 unreachable, length 78
 00:01:17.828272 IP 192.168.1.135 > 192.168.1.135: ICMP host 192.168.1.1 unreachable, length 78
 00:01:19.837352 ARP, Request who-has 192.168.1.1 tell 192.168.1.135, length 28
 00:01:20.835977 ARP, Request who-has 192.168.1.1 tell 192.168.1.135, length 28
 00:01:21.835987 ARP, Request who-has 192.168.1.1 tell 192.168.1.135, length 28
 00:01:22.836019 IP 192.168.1.135 > 192.168.1.135: ICMP host 192.168.1.1 unreachable, length 68
 00:01:22.836032 IP 192.168.1.135 > 192.168.1.135: ICMP host 192.168.1.1 unreachable, length 68
 00:01:22.836033 IP 192.168.1.135 > 192.168.1.135: ICMP host 192.168.1.1 unreachable, length 78
 00:01:24.842193 ARP, Request who-has 192.168.1.1 tell 192.168.1.135, length 28
 00:01:25.839987 ARP, Request who-has 192.168.1.1 tell 192.168.1.135, length 28
 00:01:26.839962 ARP, Request who-has 192.168.1.1 tell 192.168.1.135, length 28
 00:01:27.840161 IP 192.168.1.135 > 192.168.1.135: ICMP host 192.168.1.1 unreachable, length 68
 00:01:27.840179 IP 192.168.1.135 > 192.168.1.135: ICMP host 192.168.1.1 unreachable, length 68
 00:01:27.840188 IP 192.168.1.135 > 192.168.1.135: ICMP host 192.168.1.1 unreachable, length 78
 00:01:29.848763 ARP, Request who-has 192.168.1.1 tell 192.168.1.135, length 28
 00:01:30.847951 ARP, Request who-has 192.168.1.1 tell 192.168.1.135, length 28
 00:01:31.847985 ARP, Request who-has 192.168.1.1 tell 192.168.1.135, length 28
 00:01:32.848009 IP 192.168.1.135 > 192.168.1.135: ICMP host 192.168.1.1 unreachable, length 68
 00:01:32.848015 IP 192.168.1.135 > 192.168.1.135: ICMP host 192.168.1.1 unreachable, length 68
 00:01:32.848016 IP 192.168.1.135 > 192.168.1.135: ICMP host 192.168.1.1 unreachable, length 78
 00:01:32.848017 IP 192.168.1.135 > 192.168.1.135: ICMP host 192.168.1.1 unreachable, length 78
 00:01:34.853699 ARP, Request who-has 192.168.1.1 tell 192.168.1.135, length 28
 00:01:35.851987 ARP, Request who-has 192.168.1.1 tell 192.168.1.135, length 28
 00:01:36.852008 ARP, Request who-has 192.168.1.1 tell 192.168.1.135, length 28
 00:01:37.852200 IP 192.168.1.135 > 192.168.1.135: ICMP host 192.168.1.1 unreachable, length 68
 00:01:37.852235 IP 192.168.1.135 > 192.168.1.135: ICMP host 192.168.1.1 unreachable, length 68
 00:01:37.852236 IP 192.168.1.135 > 192.168.1.135: ICMP host 192.168.1.1 unreachable, length 78
 00:01:39.859316 ARP, Request who-has 192.168.1.1 tell 192.168.1.135, length 28
 00:01:40.855986 ARP, Request who-has 192.168.1.1 tell 192.168.1.135, length 28
 00:01:41.855997 ARP, Request who-has 192.168.1.1 tell 192.168.1.135, length 28
 00:01:42.856060 IP 192.168.1.135 > 192.168.1.135: ICMP host 192.168.1.1 unreachable, length 68
 00:01:42.856066 IP 192.168.1.135 > 192.168.1.135: ICMP host 192.168.1.1 unreachable, length 68
 00:01:42.856068 IP 192.168.1.135 > 192.168.1.135: ICMP host 192.168.1.1 unreachable, length 78
 00:01:44.864160 ARP, Request who-has 192.168.1.1 tell 192.168.1.135, length 28
 00:01:45.863985 ARP, Request who-has 192.168.1.1 tell 192.168.1.135, length 28
 00:01:46.863972 ARP, Request who-has 192.168.1.1 tell 192.168.1.135, length 28
 00:01:47.864035 IP 192.168.1.135 > 192.168.1.135: ICMP host 192.168.1.1 unreachable, length 68
 00:01:47.864040 IP 192.168.1.135 > 192.168.1.135: ICMP host 192.168.1.1 unreachable, length 68
 00:01:47.864041 IP 192.168.1.135 > 192.168.1.135: ICMP host 192.168.1.1 unreachable, length 78
 00:01:49.870051 ARP, Request who-has 192.168.1.1 tell 192.168.1.135, length 28
 00:01:50.868043 ARP, Request who-has 192.168.1.1 tell 192.168.1.135, length 28
 00:01:51.868003 ARP, Request who-has 192.168.1.1 tell 192.168.1.135, length 28
 00:01:52.868040 IP 192.168.1.135 > 192.168.1.135: ICMP host 192.168.1.1 unreachable, length 68
 00:01:52.868045 IP 192.168.1.135 > 192.168.1.135: ICMP host 192.168.1.1 unreachable, length 68
 00:01:52.868046 IP 192.168.1.135 > 192.168.1.135: ICMP host 192.168.1.1 unreachable, length 78
 00:01:54.872026 ARP, Request who-has 192.168.1.1 tell 192.168.1.135, length 28
 00:01:55.871986 ARP, Request who-has 192.168.1.1 tell 192.168.1.135, length 28
 00:01:56.871987 ARP, Request who-has 192.168.1.1 tell 192.168.1.135, length 28
 00:01:57.872041 IP 192.168.1.135 > 192.168.1.135: ICMP host 192.168.1.1 unreachable, length 68
 00:01:57.872047 IP 192.168.1.135 > 192.168.1.135: ICMP host 192.168.1.1 unreachable, length 68
 00:01:59.877547 ARP, Request who-has 192.168.1.1 tell 192.168.1.135, length 28
 00:02:00.876112 ARP, Request who-has 192.168.1.1 tell 192.168.1.135, length 28
 00:02:01.875996 ARP, Request who-has 192.168.1.1 tell 192.168.1.135, length 28
 00:02:02.876060 IP 192.168.1.135 > 192.168.1.135: ICMP host 192.168.1.1 unreachable, length 68
 00:02:02.876068 IP 192.168.1.135 > 192.168.1.135: ICMP host 192.168.1.1 unreachable, length 68
 00:02:04.880301 ARP, Request who-has 192.168.1.1 tell 192.168.1.135, length 28
 00:02:05.879943 ARP, Request who-has 192.168.1.1 tell 192.168.1.135, length 28
 00:02:06.880042 ARP, Request who-has 192.168.1.1 tell 192.168.1.135, length 28
 00:02:07.883993 IP 192.168.1.135 > 192.168.1.135: ICMP host 192.168.1.1 unreachable, length 68
 00:02:07.883998 IP 192.168.1.135 > 192.168.1.135: ICMP host 192.168.1.1 unreachable, length 68
 00:02:09.884411 ARP, Request who-has 192.168.1.1 tell 192.168.1.135, length 28
 00:02:10.884020 ARP, Request who-has 192.168.1.1 tell 192.168.1.135, length 28
 00:02:11.883985 ARP, Request who-has 192.168.1.1 tell 192.168.1.135, length 28
 00:02:12.884041 IP 192.168.1.135 > 192.168.1.135: ICMP host 192.168.1.1 unreachable, length 68
 00:02:12.884047 IP 192.168.1.135 > 192.168.1.135: ICMP host 192.168.1.1 unreachable, length 68
 00:02:14.889434 ARP, Request who-has 192.168.1.1 tell 192.168.1.135, length 28
 00:02:15.887985 ARP, Request who-has 192.168.1.1 tell 192.168.1.135, length 28
 00:02:16.887953 ARP, Request who-has 192.168.1.1 tell 192.168.1.135, length 28
 00:02:17.888050 IP 192.168.1.135 > 192.168.1.135: ICMP host 192.168.1.1 unreachable, length 68
 00:02:17.888056 IP 192.168.1.135 > 192.168.1.135: ICMP host 192.168.1.1 unreachable, length 68
 00:02:17.888057 IP 192.168.1.135 > 192.168.1.135: ICMP host 192.168.1.1 unreachable, length 78
 00:02:19.894553 ARP, Request who-has 192.168.1.1 tell 192.168.1.135, length 28
 00:02:20.891985 ARP, Request who-has 192.168.1.1 tell 192.168.1.135, length 28
 00:02:21.891998 ARP, Request who-has 192.168.1.1 tell 192.168.1.135, length 28
 00:02:22.892296 IP 192.168.1.135 > 192.168.1.135: ICMP host 192.168.1.1 unreachable, length 68
 00:02:22.892303 IP 192.168.1.135 > 192.168.1.135: ICMP host 192.168.1.1 unreachable, length 68
 00:02:22.892304 IP 192.168.1.135 > 192.168.1.135: ICMP host 192.168.1.1 unreachable, length 78
 00:02:24.900012 ARP, Request who-has 192.168.1.1 tell 192.168.1.135, length 28
 00:02:25.899987 ARP, Request who-has 192.168.1.1 tell 192.168.1.135, length 28
 00:02:26.899989 ARP, Request who-has 192.168.1.1 tell 192.168.1.135, length 28
 00:02:27.900060 IP 192.168.1.135 > 192.168.1.135: ICMP host 192.168.1.1 unreachable, length 68
 00:02:27.900067 IP 192.168.1.135 > 192.168.1.135: ICMP host 192.168.1.1 unreachable, length 68
 00:02:27.900068 IP 192.168.1.135 > 192.168.1.135: ICMP host 192.168.1.1 unreachable, length 78
 00:02:29.905997 ARP, Request who-has 192.168.1.1 tell 192.168.1.135, length 28
 00:02:30.903983 ARP, Request who-has 192.168.1.1 tell 192.168.1.135, length 28
 00:02:31.903988 ARP, Request who-has 192.168.1.1 tell 192.168.1.135, length 28
 00:02:32.904065 IP 192.168.1.135 > 192.168.1.135: ICMP host 192.168.1.1 unreachable, length 68
 00:02:32.904072 IP 192.168.1.135 > 192.168.1.135: ICMP host 192.168.1.1 unreachable, length 68
 00:02:32.904073 IP 192.168.1.135 > 192.168.1.135: ICMP host 192.168.1.1 unreachable, length 78
 00:02:34.910918 ARP, Request who-has 192.168.1.1 tell 192.168.1.135, length 28
 00:02:35.908020 ARP, Request who-has 192.168.1.1 tell 192.168.1.135, length 28
 00:02:36.907983 ARP, Request who-has 192.168.1.1 tell 192.168.1.135, length 28
 00:02:37.908058 IP 192.168.1.135 > 192.168.1.135: ICMP host 192.168.1.1 unreachable, length 68
 00:02:37.908064 IP 192.168.1.135 > 192.168.1.135: ICMP host 192.168.1.1 unreachable, length 68
 00:02:37.908065 IP 192.168.1.135 > 192.168.1.135: ICMP host 192.168.1.1 unreachable, length 78
 00:02:39.916098 ARP, Request who-has 192.168.1.1 tell 192.168.1.135, length 28
 00:02:40.915990 ARP, Request who-has 192.168.1.1 tell 192.168.1.135, length 28
 00:02:41.915984 ARP, Request who-has 192.168.1.1 tell 192.168.1.135, length 28
 00:02:42.916045 IP 192.168.1.135 > 192.168.1.135: ICMP host 192.168.1.1 unreachable, length 68
 00:02:42.916050 IP 192.168.1.135 > 192.168.1.135: ICMP host 192.168.1.1 unreachable, length 68
 00:02:42.916051 IP 192.168.1.135 > 192.168.1.135: ICMP host 192.168.1.1 unreachable, length 78
 00:02:44.921196 ARP, Request who-has 192.168.1.1 tell 192.168.1.135, length 28
 00:02:45.919988 ARP, Request who-has 192.168.1.1 tell 192.168.1.135, length 28
 00:02:46.919996 ARP, Request who-has 192.168.1.1 tell 192.168.1.135, length 28
 00:02:47.920070 IP 192.168.1.135 > 192.168.1.135: ICMP host 192.168.1.1 unreachable, length 68
 00:02:47.920076 IP 192.168.1.135 > 192.168.1.135: ICMP host 192.168.1.1 unreachable, length 68
 00:02:47.920078 IP 192.168.1.135 > 192.168.1.135: ICMP host 192.168.1.1 unreachable, length 78
 00:02:49.926656 ARP, Request who-has 192.168.1.1 tell 192.168.1.135, length 28
 00:02:50.923982 ARP, Request who-has 192.168.1.1 tell 192.168.1.135, length 28
 00:02:51.923986 ARP, Request who-has 192.168.1.1 tell 192.168.1.135, length 28
 00:02:52.924049 IP 192.168.1.135 > 192.168.1.135: ICMP host 192.168.1.1 unreachable, length 68
 00:02:52.924055 IP 192.168.1.135 > 192.168.1.135: ICMP host 192.168.1.1 unreachable, length 68
 00:02:52.924056 IP 192.168.1.135 > 192.168.1.135: ICMP host 192.168.1.1 unreachable, length 78
 00:02:54.931770 ARP, Request who-has 192.168.1.1 tell 192.168.1.135, length 28
 00:02:55.927986 ARP, Request who-has 192.168.1.1 tell 192.168.1.135, length 28
 00:02:56.927986 ARP, Request who-has 192.168.1.1 tell 192.168.1.135, length 28
 00:02:57.928041 IP 192.168.1.135 > 192.168.1.135: ICMP host 192.168.1.1 unreachable, length 68
 00:02:57.928047 IP 192.168.1.135 > 192.168.1.135: ICMP host 192.168.1.1 unreachable, length 68
 00:02:59.936901 ARP, Request who-has 192.168.1.1 tell 192.168.1.135, length 28
 00:03:00.935988 ARP, Request who-has 192.168.1.1 tell 192.168.1.135, length 28
 00:03:01.935988 ARP, Request who-has 192.168.1.1 tell 192.168.1.135, length 28
 00:03:02.936040 IP 192.168.1.135 > 192.168.1.135: ICMP host 192.168.1.1 unreachable, length 68
 00:03:02.936046 IP 192.168.1.135 > 192.168.1.135: ICMP host 192.168.1.1 unreachable, length 68
 00:03:04.942036 ARP, Request who-has 192.168.1.1 tell 192.168.1.135, length 28
 00:03:05.939986 ARP, Request who-has 192.168.1.1 tell 192.168.1.135, length 28
 00:03:06.939985 ARP, Request who-has 192.168.1.1 tell 192.168.1.135, length 28
 00:03:07.940076 IP 192.168.1.135 > 192.168.1.135: ICMP host 192.168.1.1 unreachable, length 68
 00:03:07.940081 IP 192.168.1.135 > 192.168.1.135: ICMP host 192.168.1.1 unreachable, length 68
 00:03:09.947523 ARP, Request who-has 192.168.1.1 tell 192.168.1.135, length 28
 00:03:10.943986 ARP, Request who-has 192.168.1.1 tell 192.168.1.135, length 28
 00:03:11.943988 ARP, Request who-has 192.168.1.1 tell 192.168.1.135, length 28
 00:03:12.944038 IP 192.168.1.135 > 192.168.1.135: ICMP host 192.168.1.1 unreachable, length 68
 00:03:12.944044 IP 192.168.1.135 > 192.168.1.135: ICMP host 192.168.1.1 unreachable, length 68
 00:03:14.952668 ARP, Request who-has 192.168.1.1 tell 192.168.1.135, length 28
 00:03:15.951987 ARP, Request who-has 192.168.1.1 tell 192.168.1.135, length 28
 00:03:16.951987 ARP, Request who-has 192.168.1.1 tell 192.168.1.135, length 28
 00:03:17.952049 IP 192.168.1.135 > 192.168.1.135: ICMP host 192.168.1.1 unreachable, length 68
 00:03:17.952055 IP 192.168.1.135 > 192.168.1.135: ICMP host 192.168.1.1 unreachable, length 68
 00:03:17.952056 IP 192.168.1.135 > 192.168.1.135: ICMP host 192.168.1.1 unreachable, length 78
 00:03:19.957807 ARP, Request who-has 192.168.1.1 tell 192.168.1.135, length 28
 00:03:20.955987 ARP, Request who-has 192.168.1.1 tell 192.168.1.135, length 28
 00:03:21.955984 ARP, Request who-has 192.168.1.1 tell 192.168.1.135, length 28
 00:03:22.956212 IP 192.168.1.135 > 192.168.1.135: ICMP host 192.168.1.1 unreachable, length 68
 00:03:22.956217 IP 192.168.1.135 > 192.168.1.135: ICMP host 192.168.1.1 unreachable, length 68
 00:03:22.956219 IP 192.168.1.135 > 192.168.1.135: ICMP host 192.168.1.1 unreachable, length 78
 00:03:24.962872 ARP, Request who-has 192.168.1.1 tell 192.168.1.135, length 28
 00:03:25.959987 ARP, Request who-has 192.168.1.1 tell 192.168.1.135, length 28
 00:03:26.959989 ARP, Request who-has 192.168.1.1 tell 192.168.1.135, length 28
 00:03:27.960050 IP 192.168.1.135 > 192.168.1.135: ICMP host 192.168.1.1 unreachable, length 68
 00:03:27.960055 IP 192.168.1.135 > 192.168.1.135: ICMP host 192.168.1.1 unreachable, length 68
 00:03:27.960056 IP 192.168.1.135 > 192.168.1.135: ICMP host 192.168.1.1 unreachable, length 78
 00:03:29.968283 ARP, Request who-has 192.168.1.1 tell 192.168.1.135, length 28
 00:03:30.967989 ARP, Request who-has 192.168.1.1 tell 192.168.1.135, length 28
 00:03:31.967987 ARP, Request who-has 192.168.1.1 tell 192.168.1.135, length 28
 00:03:32.968170 IP 192.168.1.135 > 192.168.1.135: ICMP host 192.168.1.1 unreachable, length 68
 00:03:32.968177 IP 192.168.1.135 > 192.168.1.135: ICMP host 192.168.1.1 unreachable, length 68
 00:03:32.968179 IP 192.168.1.135 > 192.168.1.135: ICMP host 192.168.1.1 unreachable, length 78
 00:03:34.973355 ARP, Request who-has 192.168.1.1 tell 192.168.1.135, length 28
 00:03:35.971950 ARP, Request who-has 192.168.1.1 tell 192.168.1.135, length 28
 00:03:36.971975 ARP, Request who-has 192.168.1.1 tell 192.168.1.135, length 28
 00:03:37.972027 IP 192.168.1.135 > 192.168.1.135: ICMP host 192.168.1.1 unreachable, length 68
 00:03:37.972035 IP 192.168.1.135 > 192.168.1.135: ICMP host 192.168.1.1 unreachable, length 68
 00:03:37.972036 IP 192.168.1.135 > 192.168.1.135: ICMP host 192.168.1.1 unreachable, length 78
 00:03:39.978462 ARP, Request who-has 192.168.1.1 tell 192.168.1.135, length 28
 00:03:40.975988 ARP, Request who-has 192.168.1.1 tell 192.168.1.135, length 28
 00:03:41.976005 ARP, Request who-has 192.168.1.1 tell 192.168.1.135, length 28
 00:03:42.976055 IP 192.168.1.135 > 192.168.1.135: ICMP host 192.168.1.1 unreachable, length 68
 00:03:42.976061 IP 192.168.1.135 > 192.168.1.135: ICMP host 192.168.1.1 unreachable, length 68
 00:03:42.976062 IP 192.168.1.135 > 192.168.1.135: ICMP host 192.168.1.1 unreachable, length 78
 00:03:44.983535 ARP, Request who-has 192.168.1.1 tell 192.168.1.135, length 28
 00:03:45.979987 ARP, Request who-has 192.168.1.1 tell 192.168.1.135, length 28
 00:03:46.979990 ARP, Request who-has 192.168.1.1 tell 192.168.1.135, length 28
 00:03:47.980014 IP 192.168.1.135 > 192.168.1.135: ICMP host 192.168.1.1 unreachable, length 68
 00:03:47.980020 IP 192.168.1.135 > 192.168.1.135: ICMP host 192.168.1.1 unreachable, length 68
 00:03:47.980021 IP 192.168.1.135 > 192.168.1.135: ICMP host 192.168.1.1 unreachable, length 78
 00:03:49.988966 ARP, Request who-has 192.168.1.1 tell 192.168.1.135, length 28
 00:03:50.988036 ARP, Request who-has 192.168.1.1 tell 192.168.1.135, length 28
 00:03:51.988042 ARP, Request who-has 192.168.1.1 tell 192.168.1.135, length 28
 00:03:52.988255 IP 192.168.1.135 > 192.168.1.135: ICMP host 192.168.1.1 unreachable, length 68
 00:03:52.988290 IP 192.168.1.135 > 192.168.1.135: ICMP host 192.168.1.1 unreachable, length 68
 00:03:52.988292 IP 192.168.1.135 > 192.168.1.135: ICMP host 192.168.1.1 unreachable, length 78
 00:03:54.994032 ARP, Request who-has 192.168.1.1 tell 192.168.1.135, length 28
 00:03:55.991961 ARP, Request who-has 192.168.1.1 tell 192.168.1.135, length 28
 00:03:56.991992 ARP, Request who-has 192.168.1.1 tell 192.168.1.135, length 28
 00:03:57.992061 IP 192.168.1.135 > 192.168.1.135: ICMP host 192.168.1.1 unreachable, length 68
 00:03:57.992067 IP 192.168.1.135 > 192.168.1.135: ICMP host 192.168.1.1 unreachable, length 68
 00:03:59.999177 ARP, Request who-has 192.168.1.1 tell 192.168.1.135, length 28
 00:04:00.995998 ARP, Request who-has 192.168.1.1 tell 192.168.1.135, length 28
 00:04:01.995997 ARP, Request who-has 192.168.1.1 tell 192.168.1.135, length 28
 00:04:02.996012 IP 192.168.1.135 > 192.168.1.135: ICMP host 192.168.1.1 unreachable, length 68
 00:04:02.996019 IP 192.168.1.135 > 192.168.1.135: ICMP host 192.168.1.1 unreachable, length 68
 00:04:05.004265 ARP, Request who-has 192.168.1.1 tell 192.168.1.135, length 28
 00:04:06.003992 ARP, Request who-has 192.168.1.1 tell 192.168.1.135, length 28
 00:04:07.003969 ARP, Request who-has 192.168.1.1 tell 192.168.1.135, length 28
 00:04:08.004057 IP 192.168.1.135 > 192.168.1.135: ICMP host 192.168.1.1 unreachable, length 68
 00:04:08.004063 IP 192.168.1.135 > 192.168.1.135: ICMP host 192.168.1.1 unreachable, length 68
 00:04:10.009713 ARP, Request who-has 192.168.1.1 tell 192.168.1.135, length 28
 00:04:11.007986 ARP, Request who-has 192.168.1.1 tell 192.168.1.135, length 28
 00:04:12.007995 ARP, Request who-has 192.168.1.1 tell 192.168.1.135, length 28
 00:04:13.008058 IP 192.168.1.135 > 192.168.1.135: ICMP host 192.168.1.1 unreachable, length 68
 00:04:13.008063 IP 192.168.1.135 > 192.168.1.135: ICMP host 192.168.1.1 unreachable, length 68
 00:04:15.014799 ARP, Request who-has 192.168.1.1 tell 192.168.1.135, length 28
 00:04:16.012025 ARP, Request who-has 192.168.1.1 tell 192.168.1.135, length 28
 00:04:17.012008 ARP, Request who-has 192.168.1.1 tell 192.168.1.135, length 28
 00:04:18.012067 IP 192.168.1.135 > 192.168.1.135: ICMP host 192.168.1.1 unreachable, length 68
 00:04:18.012073 IP 192.168.1.135 > 192.168.1.135: ICMP host 192.168.1.1 unreachable, length 68
 00:04:18.012074 IP 192.168.1.135 > 192.168.1.135: ICMP host 192.168.1.1 unreachable, length 78
 00:04:20.019946 ARP, Request who-has 192.168.1.1 tell 192.168.1.135, length 28
 00:04:21.019988 ARP, Request who-has 192.168.1.1 tell 192.168.1.135, length 28
 00:04:22.020008 ARP, Request who-has 192.168.1.1 tell 192.168.1.135, length 28
 00:04:23.020068 IP 192.168.1.135 > 192.168.1.135: ICMP host 192.168.1.1 unreachable, length 68
 00:04:23.020073 IP 192.168.1.135 > 192.168.1.135: ICMP host 192.168.1.1 unreachable, length 68
 00:04:23.020074 IP 192.168.1.135 > 192.168.1.135: ICMP host 192.168.1.1 unreachable, length 78
 00:04:25.025023 ARP, Request who-has 192.168.1.1 tell 192.168.1.135, length 28
 00:04:26.023990 ARP, Request who-has 192.168.1.1 tell 192.168.1.135, length 28
 00:04:27.024007 ARP, Request who-has 192.168.1.1 tell 192.168.1.135, length 28
 00:04:28.024080 IP 192.168.1.135 > 192.168.1.135: ICMP host 192.168.1.1 unreachable, length 68
 00:04:28.024086 IP 192.168.1.135 > 192.168.1.135: ICMP host 192.168.1.1 unreachable, length 68
 00:04:28.024087 IP 192.168.1.135 > 192.168.1.135: ICMP host 192.168.1.1 unreachable, length 78
 00:04:30.030507 ARP, Request who-has 192.168.1.1 tell 192.168.1.135, length 28
 00:04:31.027989 ARP, Request who-has 192.168.1.1 tell 192.168.1.135, length 28
 00:04:32.027996 ARP, Request who-has 192.168.1.1 tell 192.168.1.135, length 28
 00:04:33.028054 IP 192.168.1.135 > 192.168.1.135: ICMP host 192.168.1.1 unreachable, length 68
 00:04:33.028061 IP 192.168.1.135 > 192.168.1.135: ICMP host 192.168.1.1 unreachable, length 68
 00:04:33.028062 IP 192.168.1.135 > 192.168.1.135: ICMP host 192.168.1.1 unreachable, length 78
 00:04:35.035683 ARP, Request who-has 192.168.1.1 tell 192.168.1.135, length 28
 00:04:36.031990 ARP, Request who-has 192.168.1.1 tell 192.168.1.135, length 28
 00:04:37.031951 ARP, Request who-has 192.168.1.1 tell 192.168.1.135, length 28
 00:04:38.032009 IP 192.168.1.135 > 192.168.1.135: ICMP host 192.168.1.1 unreachable, length 68
 00:04:38.032015 IP 192.168.1.135 > 192.168.1.135: ICMP host 192.168.1.1 unreachable, length 68




-------------------------------------------------------------------------------------

**Comment by housemic** [comment]
Dear tbykowsk,
on 2018-01-24, I installed PSME Mock (node js simulator) in PODM No.1 (in the same server),
and PSME Mock screen display -Running SSDP discovery
and log file - /var/log/pod-manager/pod-manager/pod-manager-services-detection
have the PSME Mock record -
2018-01-19 11:56:22,472 [EE-ManagedScheduledExecutorService-TasksExecutor-Thread-2] INFO  c.i.p.d.e.ServiceDetectionListenerImpl - Service {URI=https://192.168.1.136:8443/redfish/v1/, type=PSME, UUID=3ddcdcb8-fb16-11e7-8a1f-774dbb7e1223} detected
2018-01-19 12:02:46,752 [EE-ManagedScheduledExecutorService-TasksExecutor-Thread-8] INFO  c.i.p.d.e.ServiceDetectionListenerImpl - Service {URI=https://192.168.1.105:8443/redfish/v1/, type=PSME, UUID=80330acc-f9d3-11e7-aef4-27af4715432f} detected
2018-01-24 17:43:10,026 [EE-ManagedScheduledExecutorService-TasksExecutor-Thread-1] INFO  c.i.p.d.e.ServiceDetectionListenerImpl - Service {URI=http://127.0.0.1:9443/redfish/v1, type=PSME, UUID=fc500510-00ea-11e8-82a9-fd7409e6577e} detected
2018-01-24 17:43:17,973 [EE-ManagedScheduledExecutorService-TasksExecutor-Thread-7] INFO  c.i.p.d.e.ServiceDetectionListenerImpl - Service {URI=http://127.0.0.1:9443/redfish/v1, type=PSME, UUID=fc500510-00ea-11e8-82a9-fd7409e6577e} detected



Today I run the PODM in a server and run PSME compute simulator in the other server,
but PODM do not find the PSME,
Is the issue related to PSME REST Server SSDP function fail ? 
thank you.

![screenshot from 2018-01-19 16-31-44](https://user-images.githubusercontent.com/35086928/37201907-00491052-23c4-11e8-8e7a-c66bf31930f8.png)

**Comment by RobertCMa** [comment]
Hi @housemic,

As below tcpdump, the simulator (10.5.250.60) can respond to the SSDP discovery from two PODM [10.5.251.20 / 10.5.250.25]
 
    10.5.250.60.1900 > 10.5.251.20.51420: UDP, length 320
    10.5.250.60.1900 > 10.5.251.20.51420: UDP, length 320
    10.5.250.60.1900 > 10.5.251.20.51420: UDP, length 320
    10.5.250.60.1900 > 10.5.251.20.51420: UDP, length 320

    10.5.250.60.1900 > 10.5.250.25.55402: UDP, length 320
    10.5.250.60.1900 > 10.5.250.25.55402: UDP, length 320
    10.5.250.60.1900 > 10.5.250.25.55402: UDP, length 320
    10.5.250.60.1900 > 10.5.250.25.55402: UDP, length 320


One configuration may need to be adjusted in "package.json", like the ip mask fitting up for your environment
    "ip": "^1.1.4"

After that modification and restart the simulator, it should be able to see the SSDP response.

However, one thing needs to be reminded. As simulator is created for test purpose, it has not considered every scenario.  It's suggested to keep the simulator usage in the same system as PODM for in-band communication.
